id,title,alternative_title,type,year,pages,image_url,file_url,abstract
D232,"Influences of solid retention time, nitrification and microbial activity on the attenuation of pharmaceuticals and estrogen /Sung Kyu Maeng and others",,article,2025.0,From p.232-243,,/static/uploads/files/D232.pdf,
D233,"Nghiên cứu xây dựng lộ trình hoạt động quản lý và thu phí sử dụng vỉa hè phục vụ mục đích kinh doanh, hướng tới phát triển kinh tế vỉa hè tại Việt Nam /Vũ Trọng Anh, Đinh Trọng Hùng",,article,2025.0,Tr.165-168,,/static/uploads/files/D233.pdf,
D234,"Nghiên cứu giải pháp nâng cao hiệu quả quản lý giao thông hàng hải tại trung tâm VTS: Áp dụng cho khu vực Hải Phòng /Lương Tú Nam, Trương Thị Kim Ngọc",,article,2025.0,Tr.161-165,,/static/uploads/files/D234.pdf,
D235,Identifying the key factors contributing to the detention of Vietnam vessels due to non-compliance with solas 74 engine room safety requirements /Dinh Gia Huy,,article,2025.0,Tr.158-160,,/static/uploads/files/D235.pdf,
D236,Đánh giá tác động giao thông nhằm chủ động phòng tránh ùn tắc và tai nạn giao thông /Khuất Việt Hùng,,article,2025.0,Tr.150-157,,/static/uploads/files/D236.pdf,
D237,"Nghiên cứu bài toán phát hiện và phân loại phương tiện đường biển từ tín hiệu hình ảnh dựa trên phương pháp học sâu hỗ trợ bảo đảm an toàn hàng hải /Lê Quyết Tiến, Lê Hoàng Dương, Trần Văn Tuyển",,article,2025.0,Tr.146-149,,/static/uploads/files/D237.pdf,
D238,"Giải pháp nâng cao hiệu quả quản lý, sử dụng các trang thiết bị hàng hải trên buồng lái tàu biển /Phạm Văn Luân, Quách Thanh Chung, Nguyễn Văn Quảng",,article,2025.0,Tr.143-145,,/static/uploads/files/D238.pdf,
D239,Nghiên cứu lựa chọn mái dốc luồng vào bến cá Cống Họng – Hải Phòng /Trần Long Giang,,article,2025.0,Tr.139-142,,/static/uploads/files/D239.pdf,
D240,"Nghiên cứu năng lực ứng dụng trí tuệ nhân tạo của chủ đầu tư trong việc lựa chọn nhà cung cấp trong các dự án chuỗi cung ứng tại Việt Nam /Nguyễn Văn Tiếp, Nguyễn Thanh Bình, Đỗ Tiến Sỹ",,article,2025.0,Tr.135-138,,/static/uploads/files/D240.pdf,
D241,"Ứng dụng phương pháp tính toán biểu tượng xác định công thức giải tích của phản lực gối đỡ hệ trục tàu thủy /Cao Đức Thiệp, Lê Đình Dũng, Bùi Thị Hằng",,article,2025.0,Tr.131-134,,/static/uploads/files/D241.pdf,
D242,Nghiên cứu phát triển mô hình động học cho robot dẫn động vi sai /Vũ Xuân Hậu,,article,2025.0,Tr.128-130,,/static/uploads/files/D242.pdf,
D243,"Developing a labview-based software for vital signals monitoring /Lê Đăng Khanh, Lê Văn Diễm",,article,2025.0,Tr.124-127,,/static/uploads/files/D243.pdf,
D244,Nghiên cứu tính toán dây neo phao có vật treo bằng phương pháp phần tử hữu hạn /Đào Văn Tuấn,,article,2025.0,Tr.120-123,,/static/uploads/files/D244.pdf,
D245,"Ứng dụng UAV trong công tác kiểm tra và phát hiện hư hại của cầu đường bộ /Phạm Trung Minh, Nguyễn Cảnh Toàn",,article,2025.0,Tr.117-119,,/static/uploads/files/D245.pdf,
D246,Nghiên cứu triển khai các giải pháp đảm bảo an toàn chạy tàu tận dụng lớp bùn loãng tại luồng ra/vào Trung tâm Điện lực Duyên Hải /Mai Bá Lĩnh,,article,2025.0,Tr.114-116,,/static/uploads/files/D246.pdf,
D247,Phân tích lực cắt trong quá trình gia công rãnh vi mô bằng phương pháp phần tử hữu hạn /Trần Ánh Viên,,article,2025.0,Tr.110-113,,/static/uploads/files/D247.pdf,
D248,"Nghiên cứu thuật toán và xây dựng chương trình dựng bản vẽ 3D chong chóng tàu thủy /Nguyễn Văn Quyết, Vũ Văn Tuyển",,article,2025.0,Tr.107-,,/static/uploads/files/D248.pdf,
D249,"Tính toán thiết kế và kiểm bền chi tiết dầm chính cổng trục đẩy tay tải trọng một tấn bằng phương pháp phần tử hữu hạn /Lê Huỳnh Đức, Nguyễn Đình Minh Quân, Nguyễn Ngọc Nhật",,article,2025.0,Tr.103-106,,/static/uploads/files/D249.pdf,
D250,Trường Cao đẳng GTVT Trung ương I - địa chỉ đào tạo nghề chất lượng cao /Bảo Châu,,article,2025.0,Tr.149-150,,/static/uploads/files/D250.pdf,
