id,title,alternative_title,type,year,pages,image_url,file_url,abstract
D132,Bài giảng Động cơ đốt trong /Hồ Đức Tuấn,,book,2023.0,259 tr.,/static/uploads/images/D132.jpg,/static/uploads/files/D132.pdf,
D133,Kỹ thuật thi công và lắp đặt hệ thống lạnh và điều hòa không khí /Nguyễn Đình Khương,,book,2024.0,627tr :Hình ảnh,/static/uploads/images/D133.jpg,/static/uploads/files/D133.pdf,
D134,Maritime English /Hồ Đức Tuấn (chủ biên) và những người khác,English - Maritime,book,2024.0,153 tr.,/static/uploads/images/D134.jpg,/static/uploads/files/D134.pdf,
D135,Quản lý khai thác cảng /Hồ Đức Tuấn,,book,2023.0,121 tr. ;,/static/uploads/images/D135.jpg,/static/uploads/files/D135.pdf,
D136,Giáo trình Công nghệ đóng sửa tàu phi kim loại /Phạm Thanh Nhựt,,book,2022.0,179 tr. :Minh họa ;27 cm,/static/uploads/images/D136.jpg,/static/uploads/files/D136.pdf,
D137,Phương pháp nghiên cứu khoa học trong nuôi trồng thủy sản /Lê Minh Hoàng,Scientific Research Methodology in Aquaculture,book,2024.0,146 tr. ;,/static/uploads/images/D137.jpg,/static/uploads/files/D137.pdf,
D138,Hướng dẫn bài tập chuyên ngành Kỹ thuật tàu thủy /Phạm Thanh Nhựt,,book,2021.0,204 tr. :Minh họa ;27 cm,/static/uploads/images/D138.jpg,/static/uploads/files/D138.pdf,
D139,Lý thuyết tài chính - tiền tệ /Võ Văn Cần (chủ biên) và tập thể bộ môn Tài chính - Ngân hàng,,book,2022.0,287 tr. :bảng biểu ;24 cm,/static/uploads/images/D139.jpg,/static/uploads/files/D139.pdf,
D140,Bài giảng pháp luật về hàng hải :Phần II /Bộ môn hàng hải,,book,2018.0,61 tr.,/static/uploads/images/D140.jpg,/static/uploads/files/D140.pdf,
D141,Bài giảng pháp luật hàng hải :Phần I /Bộ môn hàng hải,,book,2019.0,61 tr.,/static/uploads/images/D141.jpg,/static/uploads/files/D141.pdf,
D142,Bài giảng an toàn cho người và tàu cá /Nguyễn Đức Sĩ,,book,2018.0,129 tr.,/static/uploads/images/D142.jpg,/static/uploads/files/D142.pdf,
D143,"Bài giảng nghiệp vụ thuyền viên /Trần Đức Phú, Vũ Như Tân",,book,2023.0,77 tr.,/static/uploads/images/D143.jpg,/static/uploads/files/D143.pdf,
D144,Kiểm tra khuyết tật kết cấu bê tông bằng phương pháp nhiệt hồng ngoại :Sách chuyên khảo /Trần Quang Huy,Infrared thermography in detecting deteriorations in concrete structures,book,2022.0,156 tr. ;30 cm,/static/uploads/images/D144.jpg,/static/uploads/files/D144.pdf,
D145,Ứng dụng VISSIM trong mô hình dòng giao thông /Trần Quang Duy (Chủ biên) và các tác giả khác,,book,2024.0,91 tr. ;27 cm,/static/uploads/images/D145.jpg,/static/uploads/files/D145.pdf,
D146,"Thiết kế công trình kháng chấn bằng phương pháp phổ phản ứng dao động /Trần Quang Huy (chủ biên), Đặng Quốc Mỹ, Lê Thanh Cao",,book,2021.0,133 tr. ;27 cm,/static/uploads/images/D146.jpg,/static/uploads/files/D146.pdf,
D147,Marketing dịch vụ công /Nguyễn Hoài Long,,book,2025.0,102 tr. ;,/static/uploads/images/D147.jpg,/static/uploads/files/D147.pdf,
D148,"Destination management/ Nguyen Thanh Quang, Le Chi Cong",,book,2023.0,108 p.,/static/uploads/images/D148.jpg,/static/uploads/files/D148.pdf,
D149,Quản trị kinh doanh lữ hành,,book,2025.0,168 tr.,/static/uploads/images/D149.jpg,/static/uploads/files/D149.pdf,
D150,Luật du lịch Việt Nam và Quốc tế /Bộ môn Quản trị du lịch Dịch vụ và Lữ hành,,book,2025.0,367 tr. ;,/static/uploads/images/D150.jpg,/static/uploads/files/D150.pdf,
D151,Phân tích mức độ sẵn sàng chuyển đổi số của doanh nghiệp nhỏ và vừa trên địa bàn tỉnh Khánh Hòa /Nguyễn Toàn Dũng; Nguyễn Văn Ngọc: GVHD,,thesis,2025.0,77 tr. ;27 cm,/static/uploads/images/D151.jpg,/static/uploads/files/D151.pdf,
D152,Nâng cao chất lượng dịch vụ cấp giấy phép sử dụng tần số và thiết bị vô tuyến điện tại Trung tâm Tần số vô tuyến điện khu vực VII – Cục Tần số vô tuyến điện /Nguyễn Tuấn Ngọc; Nguyễn Thị Nga: GVHD,,thesis,2025.0,69 tr. :bảng biểu ;27 cm,/static/uploads/images/D152.jpg,/static/uploads/files/D152.pdf,
D153,"Đánh giá dự án phát triển sản xuất nông, lâm nghiệp bền vững, phát huy tiềm năng, thế mạnh của các vùng miền để sản xuất hàng hóa theo chuỗi giá trị tại xã Ba Cụm Bắc, huyện Khánh Sơn, tỉnh Khánh Hòa /Nguyễn Thị My; Phạm Thành Thái: GVHD",,thesis,2025.0,66 tr. ;27 cm,/static/uploads/images/D153.jpg,/static/uploads/files/D153.pdf,
D154,"Các nhân tố ảnh hưởng đến khả năng chuyển đổi số của doanh nghiệp vừa và nhỏ trên địa bàn thành phố Nha Trang, tỉnh Khánh Hòa /Mai Văn Vương; Phạm Thành Thái: GVHD",,thesis,2025.0,65 tr. ;27 cm,/static/uploads/images/D154.jpg,/static/uploads/files/D154.pdf,
D155,Đánh giá ảnh hưởng của sinh khối nấm men Saccharomyces cerevisiae trong dịch thủy phân rong sụn Kappaphycus alvarezii đến giai đoạn nuôi lưu hàu Thái Bình Dương /Nguyễn Thị Hà Trang; Phạm Thị Minh Hải: GVHD,,thesis,2025.0,"61 tr. :biểu đồ, ảnh màu ;27 cm",/static/uploads/images/D155.jpg,/static/uploads/files/D155.pdf,
D156,"Phân lập, tuyển chọn chủng Parvovirus tiềm năng cho sản xuất vắc xin phòng bệnh khô thai trên lợn /Trịnh Thị Thu Hằng; Vũ Khắc Hùng, Nguyễn Văn Duy: GVHD",,thesis,2025.0,114 tr. :minh họa ;27 cm,/static/uploads/images/D156.jpg,/static/uploads/files/D156.pdf,
D157,Đánh giá thực trạng và xây dựng giải pháp kiểm soát vi sinh vật gây bệnh tại các cơ sở sản xuất nước đá dùng liền tỉnh Khánh Hòa /Nguyễn Thị Lài; Lê Phương Chung: GVHD,,thesis,2025.0,"59 tr. :biểu đồ, ảnh màu ;27 cm",/static/uploads/images/D157.jpg,/static/uploads/files/D157.pdf,
D158,"Nghiên cứu ảnh hưởng của phương pháp dẫn truyền vaccine SiV lên khả năng kháng vi khuẩn Streptococcus iniae ở cá chẽm (Lates calcarifer Bloch, 1790) /Nguyễn Đức Toàn; Nguyễn Thị Thanh Thùy, Trần Vĩ Hích: GVHD",,thesis,2025.0,56 tr. :hình ảnh ;27 cm,/static/uploads/images/D158.jpg,/static/uploads/files/D158.pdf,
D159,"Nghiên cứu lựa chọn và ứng dụng một số chủng vi tảo trong sản xuất giống tôm he (Penaeus) tại Việt Nam /Mai Đức Thao; Phạm Quốc Hùng, Kim Jye Lee Chang: GVHD",,thesis,2025.0,153 tr. :Minh họa ;27 cm,/static/uploads/images/D159.jpg,/static/uploads/files/D159.pdf,
D160,"Các nhân tố ảnh hưởng đến thu nhập của nông hộ trồng cà phê tại huyện M'Drắk, tỉnh Đắk Lắk /Vũ Tấn Kiệt; Trương Ngọc Phong: GVHD",,thesis,2025.0,63 tr. ;27 cm,/static/uploads/images/D160.jpg,/static/uploads/files/D160.pdf,
D161,"Hoàn thiện công tác quản lý thuế thu nhập doanh nghiệp tại Chi cục thuế thành phố Nha Trang, tỉnh Khánh Hòa /Lê Thị Thúy Lan; Lê Kim Long: GVHD",,thesis,2025.0,108 tr. ;27 cm,/static/uploads/images/D161.jpg,/static/uploads/files/D161.pdf,
D162,Các nhân tố ảnh hưởng đến sự tuân thủ thuế của các doanh nghiệp có vốn đầu tư nước ngoài tại địa bàn tỉnh Khánh Hòa /Bùi Đình Khánh; Hồ Huy Tựu: GVHD,,thesis,2025.0,108 tr. ;27 cm,/static/uploads/images/D162.jpg,/static/uploads/files/D162.pdf,
D163,Hoàn thiện công tác quản lý thuế đối với hộ kinh doanh tại Chi cục Thuế khu vực nam Khánh Hòa /Trần Thị Mai; Phạm Thế Anh: GVHD,,thesis,2025.0,82 tr. ;27 cm,/static/uploads/images/D163.jpg,/static/uploads/files/D163.pdf,
D164,"Nâng cao chất lượng đội ngũ cán bộ, công chức tại Sở Văn hóa, Thể thao và Du lịch tỉnh Phú Yên /Đoàn Thị Tô Huỳnh; Bùi Bích Xuân: GVHD",,thesis,2025.0,"70 tr. :bảng, biểu đồ ;27 cm",/static/uploads/images/D164.jpg,/static/uploads/files/D164.pdf,
D165,"Phát triển sinh kế bền vững cho hộ đồng bào dân tộc thiểu số tại huyện Khánh Vĩnh, tỉnh Khánh Hòa /Cao Thị Ngọc Thanh; Nguyễn Văn Ngọc: GVHD",,thesis,2025.0,98 tr. ;27 cm,/static/uploads/images/D165.jpg,/static/uploads/files/D165.pdf,
D166,"Nghiên cứu khả năng sử dụng hai loài vi tảo Thalassiosira weissflogii và Chaetoceros muelleri trong ương nuôi ấu trùng tôm sú (Penaeus monodon Fabricius, 1798) /Đặng Lê Phương Vy; Lục Minh Diệp: GVHD",,thesis,2025.0,67 tr. :Minh họa ;27 cm,/static/uploads/images/D166.jpg,/static/uploads/files/D166.pdf,
D167,"Nghiên cứu một số đặc tính sinh học của chủng vi khuẩn Riemerella anatipestifer định hướng sản xuất vắc xin phòng bệnh nhiễm trùng huyết ở vịt /Tăng Mạnh Nhật; Lê Phương Chung, Lê Đình Hải: GVHD",,thesis,2025.0,48 tr. :Minh họa ;27 cm,/static/uploads/images/D167.jpg,/static/uploads/files/D167.pdf,
D168,"Các nhân tố ảnh hưởng đến hành vi phân loại rác tại nguồn của người dân trên địa bàn thành phố Cam Ranh, tỉnh Khánh Hòa /Phạm Thị Hồng Lệ; Phạm Thành Thái: GVHD",,thesis,2025.0,75 tr. ;27 cm,/static/uploads/images/D168.jpg,/static/uploads/files/D168.pdf,
D169,Tác động của giáo dục và đào tạo nghề đến khả năng tìm việc của lao động trẻ tại tỉnh Khánh Hòa /Lý Phương Tài; Phạm Thành Thái: GVHD,,thesis,2025.0,86 tr. ;27 cm,/static/uploads/images/D169.jpg,/static/uploads/files/D169.pdf,
D170,Dự đoán liên kết về học thuật dựa trên ontology /Thịnh Thị Thúy; Phạm Thị Thu Thúy: GVHD,,thesis,2025.0,65 tr. :Minh họa ;27 cm,/static/uploads/images/D170.jpg,/static/uploads/files/D170.pdf,
D171,"Đa dạng thành phần loài và mối quan hệ tiến hóa của giáp xác ký sinh trên vật chủ cua bơi Thalamita crenata Rüppell, 1830 tại vịnh Nha Trang, Khánh Hòa /Nguyễn Phương Liên; Đặng Thúy Bình, Nguyễn Thị Hải Thanh: GVHD",,thesis,2025.0,66 tr. :Minh họa ;27 cm,/static/uploads/images/D171.jpg,/static/uploads/files/D171.pdf,
D172,"Nghiên cứu sự biến đổi chất lượng của phi lê cá chim vây vàng trong quá trình bảo quản đông /Nguyễn Hồng Duyên; Mai Thị Tuyết Nga, Huỳnh Thị Ái Vân: GVHD",,thesis,2025.0,85 tr. ;27 cm,/static/uploads/images/D172.jpg,/static/uploads/files/D172.pdf,
D173,"Mô hình toán quá trình truyền nhiệt, truyền chất trong sấy cá đù fillet bằng bức xạ hồng ngoại kết hợp năng lượng mặt trời gián tiếp /Trần Đình Khoa; Lê Như Chính, Khổng Trung Thắng: GVHD",,thesis,2025.0,89 tr. :Minh họa ;27 cm,/static/uploads/images/D173.jpg,/static/uploads/files/D173.pdf,
D174,"Tối ưu hóa điều kiện dinh dưỡng bổ sung đến hai loài tảo Thalassiosira weissflogii Fryxell & Hasle, 1977, Tetraselmis chuii Butcher, 1959 và sử dụng kết hợp làm thức ăn cho ấu trùng tôm thẻ chân trắng (Penaeus vannamei Boone,1931) /Lương Thị Thu Thanh; Lục Minh Diệp: GVHD",,thesis,2025.0,55 tr. :Minh họa ;27 cm,/static/uploads/images/D174.jpg,/static/uploads/files/D174.pdf,
D175,Nghiên cứu bảo quản tinh trùng cá tầm Nga (Acipenser gueldenstaedtii) và cá tầm Xiberi (A. baerii) nuôi tại Lâm Đồng /Hồ Thanh Tuyền; Lương Công Trung: GVHD,,thesis,2025.0,61 tr. :Minh họa ;27 cm,/static/uploads/images/D175.jpg,/static/uploads/files/D175.pdf,
D176,"Ảnh hưởng của màu bể và Astaxanthin bổ sung lên sinh trưởng của cá tai bồ (Platax teira Forsskal, 1775) giai đoạn giống /Nguyễn Hữu Khang; Nguyễn Văn Minh: GVHD",,thesis,2025.0,47 tr. :Minh họa ;27 cm,/static/uploads/images/D176.jpg,/static/uploads/files/D176.pdf,
D177,Chất lượng tinh trùng của cá tầm Nga (Acipenser gueldenstaedtii) và cá tầm Xiberi (Acipenser baerii):Đặc tính lý hóa và ảnh hưởng của một số yếu tố sinh thái /Châu Bích Liên; Trần Văn Phước: GVHD,,thesis,2025.0,87 tr. :Minh họa ;27 cm,/static/uploads/images/D177.jpg,/static/uploads/files/D177.pdf,
D178,"Đánh giá hiệu quả sử dụng thiết bị giám sát hành trình Vifish.18 trên tàu cá tỉnh Khánh Hòa /Phạm Mai Phước; Trần Trọng Đạo, Tô Văn Phương: GVHD",,thesis,2025.0,64 tr. :Minh họa ;27 cm,/static/uploads/images/D178.jpg,/static/uploads/files/D178.pdf,
D179,"Đề xuất mô hình quản lý giao thông thông minh tại thành phố Nha Trang, tỉnh Khánh Hòa /Cao Như Ý; Nguyễn Văn Ngọc: GVHD",,thesis,2025.0,74 tr. ;24 cm,/static/uploads/images/D179.jpg,/static/uploads/files/D179.pdf,
D180,Số hóa bảng từ hình ảnh bằng thị giác máy tính /Lê Hoàn Chân; Nguyễn Khắc Cường: GVHD,,thesis,2025.0,74 tr. :Minh họa ;27 cm,/static/uploads/images/D180.jpg,/static/uploads/files/D180.pdf,
D181,"Phát triển sinh kế từ hoạt động du lịch cho hộ gia đình tại đảo Bích Đầm, thành phố Nha Trang, tỉnh Khánh Hòa /Lê Công Minh; Phạm Hồng Mạnh: GVHD",,thesis,2025.0,85 tr. ;27 cm,/static/uploads/images/D181.jpg,/static/uploads/files/D181.pdf,
D182,"Một số giải pháp phát triển kinh tế xã Ea Trang, huyện M'Drắk, tỉnh Đắk Lắk /Nguyễn Thị Sinh; Quách Thị Khánh Ngọc: GVHD",,thesis,2025.0,59 tr. :Minh họa ;27 cm,/static/uploads/images/D182.jpg,/static/uploads/files/D182.pdf,
D183,Hoàn thiện kiểm soát nội bộ đối với hoạt động quản lý hàng tồn kho tại Viễn Thông Khánh Hòa /Nguyễn Hoài Sơn; Võ Thị Thùy Trang: GVHD,,thesis,2025.0,85 tr. ;27 cm,/static/uploads/images/D183.jpg,/static/uploads/files/D183.pdf,
D184,Đánh giá hiệu quả tài chính các công ty niêm yết thuộc lĩnh vực chế biến thủy sản trên thị trường chứng khoán Việt Nam /Nguyễn Thị Ngọc Trâm; Võ Thị Thùy Trang: GVHD,,thesis,2025.0,113 tr. ;27 cm,/static/uploads/images/D184.jpg,/static/uploads/files/D184.pdf,
D185,"Ảnh hưởng của chất lượng dịch vụ, sự hài lòng và chi phí chuyển đổi đến lòng trung thành của khách hàng đại lý / cộng tác viên sử dụng ứng dụng Ignite by Igloo đối với dịch vụ bảo hiểm phi nhân thọ tại Công ty Trách nhiệm hữu hạn Axinan Việt Nam /Lê Hằng Thanh Thiện; Hồ Huy Tựu: GVHD",,thesis,2025.0,58 tr. :Minh họa ;27 cm,/static/uploads/images/D185.jpg,/static/uploads/files/D185.pdf,
D186,"Các nhân tố ảnh hưởng đến ý định tham gia bảo hiểm phi nhân thọ Bảo Việt của người dân tại thành phố Nha Trang, tỉnh Khánh Hòa /Lý Minh Hiếu; Nguyễn Ngọc Duy: GVHD",,thesis,2025.0,"xii, 61 tr :phụ lục ;27 cm",/static/uploads/images/D186.jpg,/static/uploads/files/D186.pdf,
D187,Phân tích hiệu quả hoạt động các ngân hàng thương mại Việt Nam giai đoạn 2018-2022 /Vũ Minh Hiếu; Lê Kim Long: GVHD,,thesis,2025.0,86 tr. ;27 cm,/static/uploads/images/D187.jpg,/static/uploads/files/D187.pdf,
D188,"Nghiên cứu chuỗi cung ứng cá chim vây vàng tại thành phố Nha Trang, tỉnh Khánh Hòa /Trần Thị Phương Liên; Nguyễn Thị Trâm Anh: GVHD",,thesis,2025.0,86 tr. ;27 cm,/static/uploads/images/D188.jpg,/static/uploads/files/D188.pdf,
D189,"Nghiên cứu nhân tố ảnh hưởng đến ý định tiết kiệm điện của hộ gia đình tại thành phố Tuy Hòa, tỉnh Phú Yên /Ngô Đình Duy; Trần Thị Ái Cẩm: GVHD",,thesis,2025.0,77 tr. ;27 cm,/static/uploads/images/D189.jpg,/static/uploads/files/D189.pdf,
D190,"Các yếu tố ảnh hưởng đến quyết định đầu tư của doanh nghiệp vào Khu kinh tế Vân Phong, tỉnh Khánh Hòa /Nguyễn Quốc Cường; Hà Việt Hùng: GVHD",,thesis,2025.0,66 tr. ;27 cm,/static/uploads/images/D190.jpg,/static/uploads/files/D190.pdf,
D191,"Phát triển đối tượng tham gia Bảo hiểm xã hội tự nguyện khu vực phi chính thức trên địa bàn huyện Khánh Vĩnh, tỉnh Khánh Hòa /Huỳnh Nguyễn Hồng Anh; Hà Việt Hùng: GVHD",,thesis,2025.0,85 tr. ;27 cm,/static/uploads/images/D191.jpg,/static/uploads/files/D191.pdf,
D192,Quản trị rủi ro tín dụng cá nhân tại Ngân hàng Thương mại Cổ phần Tiên Phong - chi nhánh Nha Trang /Nguyễn Lê Thanh Tuấn; Phạm Thế Anh: GVHD,,thesis,2025.0,86 tr. ;27 cm,/static/uploads/images/D192.jpg,/static/uploads/files/D192.pdf,
D193,Tạo động lực làm việc cho người lao động tại Công ty Cổ phần Lavite /Nguyễn Ngọc Trang Tâm; Nguyễn Thị Kim Anh: GVHD,,thesis,2025.0,70 tr. ;27 cm,/static/uploads/images/D193.jpg,/static/uploads/files/D193.pdf,
D194,Nâng cao năng lực cạnh tranh của sản phẩm nước tinh khiết Sanna tại Công ty cổ phần nước giải khát Sanna Khánh Hòa /Nguyễn Thị Hoàng Ngân; Nguyễn Thị Trâm Anh: GVHD,,thesis,2025.0,81 tr. :Minh họa ;27 cm,/static/uploads/images/D194.jpg,/static/uploads/files/D194.pdf,
D195,"Ứng dụng phương pháp xác định hoạt lực Spiramycin trên chủng vi sinh vật chuẩn trong đánh giá thuốc tân dược lưu hành tại thành phố Tuy Hòa /Đặng Lư Minh Hà; Nguyễn Thị Như Thường, Phạm Thị Minh Thu: GVHD",,thesis,2025.0,53 tr. ;27 cm,/static/uploads/images/D195.jpg,/static/uploads/files/D195.pdf,
D196,"Nghiên cứu độ bền và cơ chế phá hủy của mối hàn ma sát giữa hợp kim nhôm AA6061-T6 với thép không gỉ SUS316 /Hồ Hữu Huy; Trần Hưng Trà, Dương Đình Hảo: GVHD",,thesis,2025.0,103 tr. :Minh họa ;27 cm,/static/uploads/images/D196.jpg,/static/uploads/files/D196.pdf,
D197,"Nghiên cứu các hệ thống khuyến nghị, ứng dụng xây dựng website bán xe cũ /Ngô Nguyễn Tường Nghi; Nguyễn Đình Hưng: GVHD",,thesis,2025.0,53 tr. :Minh họa ;27 cm,/static/uploads/images/D197.jpg,/static/uploads/files/D197.pdf,
D198,"Khảo sát thành phần loài và biến động nguồn giống trứng cá - ấu trùng cá (Ichthyoplankton) của một số họ cá rạn phổ biến ở vùng biển ven bờ Ninh Hải, tỉnh Ninh Thuận /Nguyễn Lê Thảo My; Đặng Thúy Bình: GVHD",,thesis,2025.0,123 tr. :Minh họa ;27 cm,/static/uploads/images/D198.jpg,/static/uploads/files/D198.pdf,
D199,"Tạo chủng và xác định các đặc tính sinh học của Actinobacillus pleuropneumoniae serotype 5 đột biến mất gen apxIC và apxIIC /Trịnh Lê Hoàng Sơn; Nguyễn Thị Anh Thư, Đào Hoài Thu: GVHD",,thesis,2025.0,72 tr. :Minh họa ;27 cm,/static/uploads/images/D199.jpg,/static/uploads/files/D199.pdf,
D200,"Nghiên cứu đáp ứng miễn dịch của thành phần kháng nguyên ho gà vô bào trong vắc xin bạch hầu - uốn ván - ho gà vô bào ( DTaP và Tdap) nghiên cứu tại Viện Vắc xin và sinh phẩm y tế /Nguyễn Xuân Khánh Hà; Nguyễn Thị Anh Thư, Nguyễn Thị Lan Phương: GVHD",,thesis,2025.0,69 tr. :Minh họa ;27 cm,/static/uploads/images/D200.jpg,/static/uploads/files/D200.pdf,
D201,Direct photodegradation of carbamazepine followed by micellar electrokinetic chromatography and mass spectrometry /Vania Calisto and others,,article,2025.0,From p.127-136,,/static/uploads/files/D201.pdf,
D202,"Biochemical oxygen demand and nutrient processing in a novel multi-stage raw municipal wastewater and acid mine drainage passive co-treatment system /W.H. Strosnider, B.K. Winfrey, R.W. Nairn",,article,2025.0,From p.119-126,,/static/uploads/files/D202.pdf,
D203,Synthetic musk emissions from wastewater aeration basins /Nabin Upadhyay and others,,article,2025.0,From p.111-118,,/static/uploads/files/D203.pdf,
D204,Investigating synergism during sequential inactivation of MS-2 phage and Bacillus subtilis spores with UV/H 2 O 2 followed by free chlorine /Min Cho and others,,article,2025.0,From p.103-110,,/static/uploads/files/D204.pdf,
D205,"The role of biomass, electron shuttles, and ferrous iron in the kinetics of Geobacter sulfurreducens-mediated ferrihydrite reduction /Luke H. MacDonald, Hee Sun Moon, Peter R. Jaffe",,article,2025.0,From p.89-102,,/static/uploads/files/D205.pdf,
D206,Effect of selected metal ions on the photocatalytic degradation of bog lake water natural organic matter /Luis A. Tercero Espinoza and others,,article,2025.0,From p.79-88,,/static/uploads/files/D206.pdf,
D207,Surveillance of adenoviruses and noroviruses in European recreational waters /A. Peter Wyn-Jones and others,,article,2025.0,From p.65-20,,/static/uploads/files/D207.pdf,
D208,Direct photodegradation of carbamazepine followed by micellar electrokinetic chromatography and mass spectrometry /Daniel Stalter and others,,article,2025.0,From p.55-64,,/static/uploads/files/D208.pdf,
D209,"Inﬂuence of sampling strategies on the monitoring of cyanobacteria in shallow lakes: Lessons from a case study in France /David Pobel, Joel Robin, Jean-Francois Humbert",,article,2025.0,From p.45-54,,/static/uploads/files/D209.pdf,
D210,Feature selection methods for characterizing and classifying adaptive Sustainable Flood Retention Basins /Qinli Yang and others,,article,2025.0,From p.33-44,,/static/uploads/files/D210.pdf,
D211,A combined approach for a better understanding of wastewater treatment plants operation: Statistical analysis of monitoring /A.C. Avella and others,,article,2025.0,From p.21-32,,/static/uploads/files/D211.pdf,
D212,"Assessing the public health risk of microbial intrusion events in distribution systems: Conceptual model, available data /Marie-Claude Besner, Michele Prevost, Stig Regli",,article,2025.0,From p.2-20,,/static/uploads/files/D212.pdf,
D213,ADM1 calibration using BMP tests for modeling the effect of autohydrolysis pretreatment on the performance of continuous /Theo S.O. Souza and others,,article,2025.0,From p.325-335,,/static/uploads/files/D213.pdf,
D214,"Spatio-temporal variability of non-regulated disinfection by-products within a drinking water distribution network /Catherine Mercier Shanks, Jean-Baptiste Serodes, Manuel J. Rodriguez",,article,2025.0,From p.312-324,,/static/uploads/files/D214.pdf,
D215,Oxidation of non-steroidal anti-inflammatory drugs with aqueous permanganate /Tania Rodrıguez-Alvarez and others,,article,2025.0,From p.301-311,,/static/uploads/files/D215.pdf,
D216,"Oxidation by-products formation of microcystin-LR exposed to UV/H2O2: Toward the generative mechanism and biological toxicity /Wansong Zong, Feng Sun, Xiaojing Sun",,article,2025.0,From p.292-300,,/static/uploads/files/D216.pdf,
D217,Bioavailable and biodegradable dissolved organic nitrogen in activated sludge and trickling filter wastewater treatment plants /Halis Simsek and others,,article,2025.0,From p.282-291,,/static/uploads/files/D217.pdf,
D218,"Fatty acid content and composition of sediments from Siberian eutrophic water bodies: Implications for biodiesel production /Nadezhda N. Sushchik, Anna Yu Kuchkina, Michail I. Gladyshev",,article,2025.0,From p.273-281,,/static/uploads/files/D218.pdf,
D219,"Cần cấm thuốc lá điện tử, thuốc lá nung nóng",,article,2025.0,Tr.193,,/static/uploads/files/D219.pdf,
D220,"Buýt Hà Nội với vai trò kết nối, gia tăng giá trị cho Thủ đô",,article,2025.0,Tr.191-192,,/static/uploads/files/D220.pdf,
D221,Loại bỏ thuốc lá mới ra khỏi đời sống xã hội,,article,2025.0,Tr.189-190,,/static/uploads/files/D221.pdf,
D222,Cảnh báo ô nhiễm kim loại nặng trong bụi đường giao thông ở Việt Nam,,article,2025.0,Tr.187-188,,/static/uploads/files/D222.pdf,
D223,"Kinh nghiệm quản lý, vận hành, khai thác hệ thống đường sắt cao tốc trên thế giới",,article,2025.0,Tr.185-186,,/static/uploads/files/D223.pdf,
D224,An improved infectivity assay combining cell culture with real-time PCR for rapid quantification of human adenoviruses /Roberto A. Rodrıguez and others,,article,2025.0,From p.264-272,,/static/uploads/files/D224.pdf,
D225,Ô tô nhập khẩu thế nào trước “cú hích” giảm phí trước bạ lần 4 cho xe lắp ráp trong nước? /An Nhi,,article,2025.0,Tr.184,,/static/uploads/files/D225.pdf,
D226,"Giải pháp nâng cao hiệu quả dạy và học thực hành, thực tập xây dựng công trình giao thông /Đỗ Văn Thái, Đỗ Thị Thu Phương",,article,2025.0,Tr.181-183,,/static/uploads/files/D226.pdf,
D227,Mechanisms of simultaneous hydrogen production and estrogenic activity removal from secondary effluent though solar /Wenlong Zhang and others,,article,2025.0,From p.254-263,,/static/uploads/files/D227.pdf,
D228,"Nâng cao hiệu quả đầu tư xây dựng các công trình giao thông đường bộ trên địa bàn tỉnh Đồng Nai giai đoạn 2025 – 2030 theo hướng bền vững /Võ Tấn Đức, Trần Quang Phú, Võ Công Hậu",,article,2025.0,Tr.177-180,,/static/uploads/files/D228.pdf,
D229,"Định biên nhân sự trong tổ chức – Giải pháp nâng cao chất lượng nguồn nhân lực công chức Thanh tra Bộ Giao thông vận tải /Nguyễn Mạnh Hùng, Cấn Tất Linh",,article,2025.0,Tr.173-176,,/static/uploads/files/D229.pdf,
D230,Pesticide washoff from concrete surfaces: Literature review and a new modeling approach /Yuzhou Luo and others,,article,2025.0,From p.244-253,,/static/uploads/files/D230.pdf,
D231,Nghiên cứu triển khai dự án “Xe xanh cùng bạn đến trường” trong đô thị /Đinh Quang Toàn,,article,2025.0,Tr.169-172,,/static/uploads/files/D231.pdf,
